{
  "schema": "shieldkit-labs/p2/direct-construction-cohort-v2/v2",
  "artifactId": "direct-construction-cohort-v2",
  "status": "generic-math-certificate-set-frozen",
  "evidenceClassification": "not-evidence",
  "selection": "none",
  "tupleRef": null,
  "protocolBoundary": "component-only",
  "boundary": {
    "permittedConclusion": "base-prime-and-direct-polynomial-irreducibility-only-if-replay-passes",
    "prohibitedConclusion": "no-BCH-cost-field-family-proof-system-protocol-Circle-domain-or-systemic-soundness-conclusion"
  },
  "inputBindings": [
    {
      "path": "research-lanes/bch-shielded-pool-design/p2/construction-freeze/construction-freeze.v1.json",
      "schema": "shieldkit-labs/p2/construction-freeze/v1",
      "schemaPath": "research-lanes/bch-shielded-pool-design/p2/construction-freeze/construction-freeze.v1.schema.json",
      "schemaSha256": "86fc5e3ca1f26e813a07c12975aec15f5421e6692ed2082eb1b8f40b8ce16fb6",
      "fileSha256": "5b276ff979fdb61c5919ef74c324cd62295fec99a8f2e9f5455f3adfdac237bc",
      "contentDigest": "9737fb064d3b706835e441ec0b4d15aefb743fb62b098d4d3692321050e83137",
      "byteCount": 10203,
      "schemaByteCount": 10389
    },
    {
      "path": "research-lanes/bch-shielded-pool-design/p2/construction-freeze/construction-freeze.normalized-transcript.v1.json",
      "schema": "shieldkit-labs/p2/construction-freeze-normalized-transcript/v1",
      "schemaPath": "research-lanes/bch-shielded-pool-design/p2/construction-freeze/construction-freeze-normalized-transcript.v1.schema.json",
      "schemaSha256": "1d3ea6e7c1136f04e8bcebff211f57761c030add9f274c6b548596eead5492cf",
      "fileSha256": "58edd442a8700d9d2014f8d238ea6d7116e64baa427b3c89c33bc9d4878c20fe",
      "contentDigest": "8eb2039920ae163c3584ca7a4b55ab5804f836760420b9cda185c4487ecf0dea",
      "byteCount": 8260251,
      "schemaByteCount": 3168
    },
    {
      "path": "research-lanes/bch-shielded-pool-design/p2/schedule-freeze/schedule-freeze.v1.json",
      "schema": "shieldkit-labs/p2/schedule-freeze/v1",
      "schemaPath": "research-lanes/bch-shielded-pool-design/p2/schedule-freeze/schedule-freeze.v1.schema.json",
      "schemaSha256": "ce75be25b66c8663c4d1f71e98485713afe66454fb8e283bab468834df719f6a",
      "fileSha256": "b96da97b99bcf45f34b77ea66c0e44192533634f10a48af1c889b8d0e1fdb173",
      "contentDigest": "099bfc6ea2b571829985f74d62e5138a948d977c7f00e2a2eec94e7d643fae6c",
      "byteCount": 63153,
      "schemaByteCount": 15419
    }
  ],
  "scheduleOrder": [
    {
      "constructionId": "algebra-construction:m89-d2-x2-plus-1-v1",
      "certificateEntryId": "certificate-entry:m89-d2-x2-plus-1-v1",
      "fieldSpecRef": "field-spec:m89-d2",
      "q": 89,
      "degree": 2,
      "polynomialCanonical": [
        "1",
        "0",
        "1"
      ]
    },
    {
      "constructionId": "algebra-construction:m61-d3-x3-minus-5-v1",
      "certificateEntryId": "certificate-entry:m61-d3-x3-minus-5-v1",
      "fieldSpecRef": "field-spec:m61-d3",
      "q": 61,
      "degree": 3,
      "polynomialCanonical": [
        "2305843009213693946",
        "0",
        "0",
        "1"
      ]
    },
    {
      "constructionId": "algebra-construction:m31-d5-x5-plus-2x-minus-1-v1",
      "certificateEntryId": "certificate-entry:m31-d5-x5-plus-2x-minus-1-v1",
      "fieldSpecRef": "field-spec:m31-d5",
      "q": 31,
      "degree": 5,
      "polynomialCanonical": [
        "2147483646",
        "2",
        "0",
        "0",
        "0",
        "1"
      ]
    },
    {
      "constructionId": "algebra-construction:m31-d6-x6-minus-5-v1",
      "certificateEntryId": "certificate-entry:m31-d6-x6-minus-5-v1",
      "fieldSpecRef": "field-spec:m31-d6",
      "q": 31,
      "degree": 6,
      "polynomialCanonical": [
        "2147483642",
        "0",
        "0",
        "0",
        "0",
        "0",
        "1"
      ]
    }
  ],
  "importedSourceBindings": [
    {
      "path": "research-lanes/bch-shielded-pool-design/p2/field-cert/node/generate.mjs",
      "sha256": "664b06ebde52749620e506cdc6fd04e024b87e0753768d4644ee22303d6bae71"
    },
    {
      "path": "research-lanes/bch-shielded-pool-design/p2/field-cert/node/replay.mjs",
      "sha256": "b2ff5132e26c3c1aff24488cabf82664eb4ae17c80aa4a8e00c328100a0e7247"
    },
    {
      "path": "research-lanes/bch-shielded-pool-design/p2/field-cert/node/canonical.mjs",
      "sha256": "396dbbc73d956d040dba952b3bb98b98898075fde24c4782badb87de800c0f23"
    },
    {
      "path": "research-lanes/bch-shielded-pool-design/p2/field-cert/node/fp-polynomial.mjs",
      "sha256": "a6b35ead871add9fe7ed3ae77497e9ba0111d17de20c8ad60537d277fba97cb9"
    },
    {
      "path": "research-lanes/bch-shielded-pool-design/p2/field-cert/node/mersenne.mjs",
      "sha256": "8d9c5eaae0105c2b29d32c82d30532e89046a71a977cbf0c54feabbe393e077b"
    }
  ],
  "repositoryEnvironment": {
    "nodeVersion": "v22.23.1",
    "platform": "linux",
    "arch": "x64",
    "policy": "certificate bytes are frozen for this recorded environment; a runtime mismatch is diagnostic and fail-closed for promotion, never silently incorporated into canonical bytes"
  },
  "toolBinding": {
    "generatorCommand": "node generate.mjs",
    "replayCommand": "node repository-replay.mjs direct-construction-cohort-v2.v2.json"
  },
  "replayReportBinding": {
    "path": "repository-replay-report.v2.txt",
    "byteCount": 967,
    "sha256": "7529af8adacb43ed38252f57fb0a807f5b235086325f45637e93dd054fc5c1f3"
  },
  "certificates": [
    {
      "certificateEntryId": "certificate-entry:m89-d2-x2-plus-1-v1",
      "constructionId": "algebra-construction:m89-d2-x2-plus-1-v1",
      "fieldSpecRef": "field-spec:m89-d2",
      "q": 89,
      "degree": 2,
      "p": "618970019642690137449562111",
      "polynomialCanonical": [
        "1",
        "0",
        "1"
      ],
      "certificateId": "certificate:mersenne-q89-d2-rabin",
      "certificateDigest": "10969251c66cbabff787da8045bf0efa4a78673f21f117f3b075e02d763d72d1",
      "replayPassed": true,
      "establishes": "base-prime-and-direct-polynomial-irreducibility-only-if-replay-passes",
      "certificate": {
        "certificateId": "certificate:mersenne-q89-d2-rabin",
        "mersennePrimeCheck": {
          "mersenneExponent": "89",
          "exponentPrime": true,
          "exponentPrimalityMethod": "deterministic-trial-division",
          "modulus": "618970019642690137449562111",
          "lucasLehmer": {
            "iterations": "87",
            "residue": "0",
            "passed": true
          },
          "classification": "prime"
        },
        "modulus": "618970019642690137449562111",
        "coefficientEncoding": "unsigned-decimal-c0-to-cd",
        "polynomial": [
          "1",
          "0",
          "1"
        ],
        "degree": "2",
        "hPowers": [
          {
            "index": "0",
            "coefficients": [
              "0",
              "1"
            ]
          },
          {
            "index": "1",
            "coefficients": [
              "0",
              "618970019642690137449562110"
            ]
          },
          {
            "index": "2",
            "coefficients": [
              "0",
              "1"
            ]
          }
        ],
        "primeDivisors": [
          "2"
        ],
        "witnesses": [
          {
            "primeDivisor": "2",
            "hIndex": "1",
            "g": [
              "0",
              "618970019642690137449562109"
            ],
            "gcd": [
              "1"
            ],
            "bezoutU": [
              "1"
            ],
            "bezoutV": [
              "0",
              "309485009821345068724781056"
            ]
          }
        ],
        "finalResidue": [
          "0",
          "1"
        ],
        "conclusion": "irreducible"
      }
    },
    {
      "certificateEntryId": "certificate-entry:m61-d3-x3-minus-5-v1",
      "constructionId": "algebra-construction:m61-d3-x3-minus-5-v1",
      "fieldSpecRef": "field-spec:m61-d3",
      "q": 61,
      "degree": 3,
      "p": "2305843009213693951",
      "polynomialCanonical": [
        "2305843009213693946",
        "0",
        "0",
        "1"
      ],
      "certificateId": "certificate:mersenne-q61-d3-rabin",
      "certificateDigest": "a8b34cef2828c3de1a88e7a3b0f59c38e993a36b38bbc628d33a621331e5e62b",
      "replayPassed": true,
      "establishes": "base-prime-and-direct-polynomial-irreducibility-only-if-replay-passes",
      "certificate": {
        "certificateId": "certificate:mersenne-q61-d3-rabin",
        "mersennePrimeCheck": {
          "mersenneExponent": "61",
          "exponentPrime": true,
          "exponentPrimalityMethod": "deterministic-trial-division",
          "modulus": "2305843009213693951",
          "lucasLehmer": {
            "iterations": "59",
            "residue": "0",
            "passed": true
          },
          "classification": "prime"
        },
        "modulus": "2305843009213693951",
        "coefficientEncoding": "unsigned-decimal-c0-to-cd",
        "polynomial": [
          "2305843009213693946",
          "0",
          "0",
          "1"
        ],
        "degree": "3",
        "hPowers": [
          {
            "index": "0",
            "coefficients": [
              "0",
              "1"
            ]
          },
          {
            "index": "1",
            "coefficients": [
              "0",
              "1669582390241348315"
            ]
          },
          {
            "index": "2",
            "coefficients": [
              "0",
              "636260618972345635"
            ]
          },
          {
            "index": "3",
            "coefficients": [
              "0",
              "1"
            ]
          }
        ],
        "primeDivisors": [
          "3"
        ],
        "witnesses": [
          {
            "primeDivisor": "3",
            "hIndex": "1",
            "g": [